{
  "schema_version": "1.0",
  "source_script": {
    "path": "episode-01.md",
    "version": "sha256:example",
    "scope": "第1集",
    "evidence_locator": "原文第1-4段"
  },
  "analysis_status": "approved",
  "global_model": {
    "causal_chain": [],
    "information_reveals": [],
    "emotion_curve": [],
    "relationship_changes": [],
    "timeline": [],
    "locations": [],
    "prop_states": []
  },
  "scenes": [
    {
      "scene_id": "scene-001",
      "source_range": "第1段",
      "dramatic_beats": [],
      "entry_state": {},
      "exit_state": {},
      "facts": ["fact-001"],
      "issues": ["issue-001"],
      "assumptions": ["assumption-001"]
    }
  ],
  "facts": [
    {
      "id": "fact-001",
      "claim": "人物在场",
      "evidence_level": "原文明示",
      "source": "原文第1段",
      "status": "confirmed"
    }
  ],
  "issues": [
    {
      "id": "issue-001",
      "severity": "一般",
      "status": "已复核关闭",
      "affected_ids": ["scene-001"],
      "allowed_direction": "保持原文",
      "forbidden_changes": []
    }
  ],
  "assumptions": [
    {
      "id": "assumption-001",
      "claim": "待核实的空间连接",
      "evidence": ["原文第1段"],
      "rejected_alternatives": [],
      "affected_ids": ["scene-001"],
      "invalidation_conditions": ["出现相反场景证据"],
      "status": "temporary",
      "confirmation": {
        "record": "",
        "date": "",
        "scope": "",
        "promoted_fact_id": ""
      }
    }
  ],
  "confirmed_actions": [
    {
      "id": "action-001",
      "action": "保持原文顺序",
      "scope": "第1集"
    }
  ],
  "routes": {
    "short-drama-story-writing": {
      "fact_ids": ["fact-001"],
      "issue_ids": ["issue-001"],
      "assumption_ids_candidate_only": ["assumption-001"],
      "confirmed_action_ids": ["action-001"]
    },
    "short-drama-assets": {
      "fact_ids": ["fact-001"],
      "issue_ids": [],
      "assumption_ids_candidate_only": [],
      "confirmed_action_ids": []
    },
    "short-drama-prompts": {
      "fact_ids": ["fact-001"],
      "issue_ids": [],
      "assumption_ids_candidate_only": [],
      "confirmed_action_ids": []
    },
    "short-drama-image-design": {
      "fact_ids": ["fact-001"],
      "issue_ids": [],
      "assumption_ids_candidate_only": [],
      "confirmed_action_ids": []
    }
  }
}
